  ,REVIEW SENTID,REVIEW SENT,REVIEW AUID,RESPONSE SENTID,RESPONSE SENT,RESPONSE AUID
3295796,50000549,Looked nothing like website photos.,,,,
3295796,50000550,-,,,,
3295796,50000551,The wifi situation SUCKS.,V80000461,,,
3295796,50000552,"There is ""free"" temporary wifi in rooms but I couldn't get a signal.",,,,
3295796,50000553,I tried to pay repeatedly for the actual wifi and was unable.,,,,
3295796,50000554,A 5-star hotel must include superior wifi service in all rooms.,,,,
3295796,50000555,-,,,,
3295796,50000556,The coffee bar took three people and 15 minutes to make a latte and topped it with cocoa powder?,V80000461,,,
3295796,50000557,-,,,,
3295796,50000558,"While my starter and the bread/butter at dinner were very good, the service was terrible (he'd disappear for ages) and the Salmon main was undercooked and bland.",V80000461,,,
3295796,50000559,I don't even remember dessert.,,,,
3295796,50000560,And expensive!,,,,
3295796,50000561,- Room service pizza was a fluffy mess.,V80000461,,,
3295796,50000562,"- I felt, even at $175/night that I overpaid.",,,,
,,,,,,
3204632,50000570,Attention to detail and genuine hospitality ---SEP---,,80000470,Wow!,
3204632,50000571,"Prior to arrival, the owner Chris emailled to check about how we would like the rooms configured and as to dietary requirements etc which was a great start.",,80000471,Thank you for this review!,
3204632,50000572,On arrival we were warmly welcomed to a lovely little seperate apartment surrounded by fragrant gardens and in a quiet area of Cambridge.,,,,
3204632,50000573,"We appreciated the attention to detail, from the plethora of soft towels in the bathroom, to the wide variety of fresh condiments, to the detailed visitor booklet with information on absolutely everything in the area.",,,,
3204632,50000574,"There is a fan and heater to use if required as it has no air con, and a lovely outdoor spa in a private location.",,,,
3204632,50000575,"Beds were comfortable; large shower room, flat screen tv and plunger coffee.",,,,
3204632,50000576,"Breakfast was freshly baked delicious muffins which were a big hit with everyone (thank you Chris!), a generous supply of bread for toast as well as yoghurt and cereal choices.",,,,
3204632,50000577,Muffins b&b is obviously run by someone who loves what she does and it really shows.,,,,
3204632,50000578,We are international visitors but if back in the area we would not consider staying anywhere else.,,,,
,,,,,,
3290679,50000580,Mr ---SEP--- Best to none had a fabulous time at the hotel and the staffs were amazing looked me after all my needs Iâ€™ll definitely be back â­ï¸ â­ï¸ â­ï¸ â­ï¸ â­ï¸,,80000480,"Dear Matthew, Thank you for sharing your feedback from your recent stay with us.",
3290679,50000581,Where you book and and get there ask for Barbara or Katrina or matthew they will definitely look after you .,,80000481,It is much appreciated.,
3290679,,,,80000482,"On behalf of the whole team, I am looking forward to welcome you back very soon.",
3290679,,,,80000483,"Kind regards, Katarina Vujcikova Guest Relations Manager",
,,,,,,
3261453,50000590,Back after 18 months and still as delightful ---SEP---,80000490,80000490,"Hi 828michelle, Thank you so much for your lovely words and we are happy to hear that you had another wonderful memories returned back to Queenstown.",
3261453,50000591,We recently visited Queenstown and didn't hesitate to return to this lovely little boutique hotel.,80000490,80000491,"I have to agree with you, Botanic Garden and the Lake side are just stroll from our boutique hotel.",
3261453,50000592,Great location with just a stroll to the Lake Front via Botanic Gardens.,80000491,80000492,"On behalf of all the Ladies & Gentlemen here, we certainly hope that we will see you again in the future.",
3261453,50000593,Very friendly and helpful welcome.,,80000493,"Cheers, Anderson",
3261453,50000594,"Super room - large - gorgeous comfy bed, lovely bathroom with big relaxing spa bath, lovely chairs and foot rests where you can relax with a wine and watch the gondola.....",,,,
3261453,50000595,This place is just perfect for us and we will not hesitate to return...again...when next in Queenstown,80000492,,,
,,,,,,
3189147,50000600,Amazing stay in a Victorian style Hotel ---SEP---,,80000500,Thank you for your time to share your experience with Best Western Plus Dorchester Hotel!,
3189147,50000601,"We stayed for a weekend with my boyfriend at this hotel and were nicely surprised, how well renovated it was and how tidy and comfortable was the room.",80000502,80000501,"We strive to serve all our guests with full care, and I'm glad to hear that you've enjoyed staying at our hotel.",
3189147,50000602,The hotel did a great job at renovating the place and decorating it still keeping it in Victorian style.,,80000502,"We try to maintain our building as convenient as possible for all our guests,we also have outside patio on the 3rd floor for guests to enjoy summer breeze in Nanaimo.",
3189147,50000603,We really enjoyed our stay there and will be definitely back soon again!,80000503,80000503,Hope both of you enjoy best summer ahead and will be looking forward to welcoming you again on your next visit to Nanaimo.,
3189147,,,,80000504,"Sincerely, Julie Park General Manager Best Western Plus Dorchester Hotel",
,,,,,,
3283926,50000610,Bonanza in Bendigo ---SEP---,,80000510,"Hello Graham A, Thank you for your great feedback.",
3283926,50000611,Much more than just a motel overnighter.,,80000511,I am so pleased that you enjoyed your stay with us and the apartment met your expectations.,
3283926,50000612,Spacious facilities quality fittings and kitchen as well.,80000511,80000512,We look forward to having you stay with us again soon.,
3283926,50000613,Would suit multiple stay or even the one night.,,,,
3283926,50000614,Just like home!,,,,
3283926,50000615,"Plenty of parking, quiet location even on the main road.",,,,
,,,,,,
3256745,50000620,"Great Hotel, ideal location ---SEP--- Stayed for 10 days Feb-Mar 17, loved this hotel.",,80000520,Many thanks for your feedback.,
3256745,50000621,"Arrived late at night 10pm, was meet by Ellie who showed us the key safe for our room.",,80000521,We look forward to seeing them again.,
3256745,50000622,"Great location to beach, used the beach chairs & towels provided.",,,,
3256745,50000623,"The room was prefect for us, spotless on arrival, the kitchen enables you to make a light breakfast or lunch, great coffee machine.",,,,
3256745,50000624,"We always had hot water in the shower, just let it run for a couple of minutes.",,,,
3256745,50000625,"Spent a lot of time on the beach at Lauderdale by the Sea, about 8 miles away.",,,,
3256745,50000626,"Didn't hire a car but used the Sun Trolley ($1), Galt Link (free from Galleria Mall) and city bus no. 11 ($2).",,,,
3256745,50000627,"The room was serviced each time we left the sign on the doors, usually clean towels, bins emptied etc.",,,,
3256745,50000628,"Ellie, Kim & Chris were all really helpful and there is always some-one around from 9am - 5pm or a phone call away.",,,,
3256745,50000629,"Have to mention our favourite bar/restaurant Casablanca's, just at 5 minute walk away, great staff, food and music.",,,,
3256745,50000630,"Yes, there is construction site opposite but there is so much to do in Fort Lauderdale we didn't spend much time by the pool, construction noise cannot be heard in the room (203).",,,,
3256745,50000631,"Kim helped us book the Everglades Air boat Trip, the company picked us up from the hotel and dropped us back, a great day out.",,,,
3256745,50000632,Would definitely go back,80000521,,,
,,,,,,
3314297,50000640,Great hotel and location.,,80000530,"Hi Imwainui, Thanks for the great review!",
3314297,50000641,---SEP---,,80000531,We're glad to hear you enjoyed our famous Rydges Dream Beds!,
3314297,50000642,A very enjoyable hotel to stay in all areas.,,80000532,Nothing like a good nights sleep after a hard days shopping.,
3314297,50000643,All staff very professional and helpful in their designated duties.,,80000533,See you next time in Wellington!,
3314297,50000644,Found the pillows too high the first night so rang reception to request flatter ones which arrived within minutes.,V80000532,80000534,^Alana P,
3314297,50000645,Beds are divinely comfortable.,80000532,,,
3314297,50000646,Breakfast choices are the best I have come across in a NZ hotel.,,,,
3314297,50000647,Many healthy options also if you wish!,,,,
3314297,50000648,Heated pool and spa was great after a days shopping!,,,,
3314297,50000649,Very central location that is within walking distance to many places of interest.,,,,
,,,,,,
3316144,50000650,"Fairly priced ---SEP--- Stayed here while working in Holyhead, bed was very comfortable and room was clean.",80000541,80000540,Thank you for taking the time to write a review.,
3316144,50000651,The bathroom was a good size.,,80000541,We are so pleased to learn that you were happy with the overall experience and found the staff helpful and friendly and your bed comfortable.,
3316144,50000652,The staff were always happy to help and very polite.,80000541,80000542,We strive to give customers an enjoyable stay and we are happy to see that this has been achieved.,
3316144,50000653,Make sure you get there early as parking can be an issue.,,80000543,Feedback such as yours is invaluable and we will ensure the hotel receives a copy of your comments.,
3316144,50000654,Close to the town and a McDonald's round the corner,,80000544,Thank you once again and we look forward to welcoming you back in the future.,
,,,,,,
,,,,,,
3214363,50012250,Great Midtown hotel ---SEP--- Loved our 4 night stay at the Bryant Park Hotel in a Junior Suite.,,80009580,"Hi John, Thank you for taking the time to review us and for remembering those employees that had such a positive impact on your stay.",
3214363,50012251,"First big plus, as the name suggests, is that itâ€™s on Bryant Park which imparts sunlight and space in front of the hotel and gets away from the often claustrophobic nature of high rise streets in NYC (getting a Suite or a park facing room will make the most of the view)",,80009581,I couldn't wait to show John and Ricardo your review.,
3214363,50012252,"First impressions count after an 8 hour flight from the UK and John the doorman was so welcoming, but check-in was perfunctory and disinterested.",80009581,80009582,Ricardo has only been with us for less than a month and has already proven to be an amazing find.,
3214363,50012253,"This negative vibe was then rescued by Ricardo who showed us to our room, and whoâ€™s friendly nature set the tone for every other interaction with hotel staff members - all were wonderful with Andrew on the Concierge desk being especially helpful.",80009581,80009583,I am very happy that you left with some wonderful birthday memories.,
3214363,50012254,Our Junior Suite was fantastic.,,80009584,I was surprised to hear about the desk agent and would love to chat more.,
3214363,50012255,"A huge room by NYC hotel standards with minimalist modern decor, high ceilings, big windows and a truly massive bathroom with a deep soaking tub and separate walk in shower (made all the better by knock you over water pressure and Molton Brown toiletries).",,80009585,Email me when you can.,
3214363,50012256,A happy birthday cake and balloon in the room was a nice touch and much appreciated.,80009583,80009586,"All my best, Darren; dsumner@bryantparkhotel.com",
3214363,50012257,We were on the 16th floor and noticed NYC traffic noise the first night but after that it wasnâ€™t an issue.,,,,
3214363,50012258,Hotel lobby is quite small but the new Moroccan themed Celon bar in the basement is great for cocktails and Tapas.,,,,
3214363,50012259,The Koi Sushi restaurant on the premises is also very good - pricey but worth it.,,,,
3214363,50012260,"Both the bar and restaurant get very busy in the evenings with city office workers, especially at weekends, so you need to reserve a table.",,,,
3214363,50012261,"Overall we really rated this hotel and preferred it to the nearby, pricier Archer Hotel that we stayed at on our last visit.",,,,
,,,,,,
3217214,50012270,Great Hotel Despite its Size ---SEP---,,80009590,"Dear Chelsea33, Thank you kindly for sharing your great review.",
3217214,50012271,We stayed here for 2 nights in March for vacation and used our starwood points.,80009591,80009591,I am delighted that you chose to spend March break with us and had a great time.,
3217214,50012272,The hotel is huge but the service was very good.,,80009592,"I hope you did take advantage of our special March break activities and hope to welcome you back this summer - when the construction on Queen's Quay will be done, so that you can truly appreciate Toronto's waterfront.",
3217214,50012273,We requested a room on a high a nice view and got a nice view overlooking the water.,,80009593,"Stay well, Edwin Frizzell General Manager",
3217214,50012274,Very pretty.,,,,
3217214,50012275,Nice location right by the harbor but lots of construction all around.,,,,
3217214,50012276,The pool is very large but very popular.,,,,
3217214,50012277,I would definitely recommend this hotel.,,,,
,,,,,,
3185113,50012280,Wonderful stay!!,,80009600,"Dear Steve and Lori, Thank you for your wonderful review!",
3185113,50012281,---SEP---,,80009601,"We are so pleased that you enjoyed your stay, it was a pleasure to host you both.",
3185113,50012282,From the moment we arrived at this historic boutique hotel we began to relax and brush off the wear and tear of international travel.,,80009602,Thank you for posting your photo's as well we absolutely love them!,
3185113,50012283,The accommodations are top notch and they have thought of everything.,,80009603,"Warm regards, Jade, Jay and Team",
3185113,50012284,The breakfast is wonderful and the canapÃ©s and drinks in the early evening are a treat.,,,,
3185113,50012285,All the staff are delightful and helpful with local attractions and dining.,,,,
3185113,50012286,Definitely recommend!,,,,
,,,,,,
3172357,50012290,"Great location and excellent breakfast ---SEP--- Very comfortable room and exceptionally clean, with tea and coffee making facilities and a cheese board and knife, which is a nice touch.",80009611,80009610,Many thanks for your review we are pleased you enjoyed your stay with us.,
3172357,50012291,Milk in the fridge and wine glasses in the room.,,80009611,"We are happy that you found guesthouse clean,comfortable and you enjoyed the breakfast selection and you found our room amenities useful .",
3172357,50012292,The host was very friendly and greeted us on arrival.,,80009612,Glad you found the excellent location of the guesthouse to be in easy walk to the town centre and the jetty.,
3172357,50012293,Great continental breakfast with everything you could want.,,80009613,We truly appreciate our guests taking time out in their busy lives to write a review.,
3172357,50012294,Very close to the jetty and local restaurants.,80009612,80009614,Thanks once again and looking forward to seeing you again.,
3172357,50012295,On site secure parking We will be back.,,80009615,Best wishes Mike and Lorraine,
,,,,,,
3205422,50012300,Our 3 night stay in the Wineport Lodge could not have been better ---SEP---,,80009620,"Dear Stephen31, Thank you for your recent popsting on Trip Advisor.",
3205422,50012301,We had our wedding reception in the Wineport in 2007.,,80009621,We were delighted that you enjoyed our stay with us here at The Wineport Lodge.,
3205422,50012302,We decided to make our long overdue return at the weekend for a 3 night stay.,,80009622,We have passed on your great comments to our colleagues throughout the hotel.,
3205422,50012303,We drove down from Dublin on Friday evening and arrived around 9pm to find we had been upgraded to the same room we stayed in on our wedding night.,,80009623,We do hope to get the opportunity to welcome you back very soon.,
3205422,50012304,It was pure luxury with the most amazing view of the lake.,,80009624,"Warmest Regards, Ray Byrne & Jane English",
3205422,50012305,The service we received over the 3 days was second to none.,80009622,,,
3205422,50012306,They made us feel so special.,,,,
3205422,50012307,We had our dinner in the restaurant on Saturday night - Duck Confit / Indian selection for starters and Fillet steaks for the main course.,,,,
3205422,50012308,The food and the service were both excellent.,80009622,,,
3205422,50012309,The weekend was not cheap (for us) but it was worth every cent.,,,,
3205422,50012310,We both enjoy going on weekends away and we cannot think of a nicer place to stay.,,,,
3205422,50012311,We wont leave it so long the next time.,,,,
,,,,,,
3280329,50012320,"Awesome secluded stay ---SEP--- Perfect oasis, gorgeous drive in and views from the lodge.",,80009630,"Samantha H, we appreciate your review of Red Cliffs Lodge.",
3280329,50012321,"Dinner is great onsite, but pricey.",,80009631,It's great to hear that you enjoyed your visit and we hope to have you stay with us again in the future!,
3280329,50012322,"There is hardly any cell service and the wifi does not work well, but that's ok since you're on vacation.",,80009632,"Best Wishes, R. Graham - Online Rep - Red Cliffs Lodge",
3280329,50012323,The horses are very friendly and you get free cookies!,,,,
,,,,,,
3214460,50012330,Great location ---SEP---,,80009640,Dear Nicol S Thank you for taking the time to leave a review.,
3214460,50012331,"We stayed 1 night for NYE, great location for city centre, (less than 5 mins walk to thermae bath spa and main shopping area) staff very friendly, helpful and obliging.",80009641,80009641,I am so pleased you enjoyed your new years stay with us and that you felt the team looked after you!,
3214460,50012332,Tea coffee selection was good.,,80009642,As you have mentioned with the valet service - it is Â£30 however it is best to prebook as it gets booked up quick!,
3214460,50012333,"Lovely elemis products in the bathroom, nice big bath and big shower too.",,80009643,We do hope to welcome you back to the hotel again soon Kindest regards Freya Cunningham Assistant Front Office Manager,
3214460,50012334,very comfortable nights sleep!,,,,
3214460,50012335,We were able to use the pool/sauna after check out which was very nice.,,,,
3214460,50012336,"Â£30 to use the valet parking for 24 hours we were lucky as didn't book this service and only limited spaces available, would use this service again (Charlotte street car park a short walk away, but nice not to have to cart luggage around plus the hotel is a bit more flexible with the time limit)",80009642,,,
,,,,,,
3196559,50012340,Terrific Location and Good Service ---SEP---,,80009650,"Dear YiiYng, Thank you for your loyal custom and for your kind review of The Westbury Hotel on Tripadvisor.",
3196559,50012341,You could not ask for a better located hotel.,,80009651,I am delighted to read that you had a most enjoyable stay on this occasion and that you have chosen to stay with us again and again.,
3196559,50012342,Good service and nice decor.,,80009652,"The Westbury Hotel has a wide range of rooms, executive rooms and suites which are always worth considering simply because of the sheer quality of the interior decoration, the hotel's location and the impeccable service which we provide.",
3196559,50012343,Rooms sometimes vary in standard.,80009652,80009653,"Also keep in mind that through the hotel's loyalty programme, The Global Hotel Alliance, it is sometimes possible to avail of a complimentary upgrade based on your frequency as one of our guests and of course on availability.",
3196559,50012344,They are all good but some are better than others.,80009652,80009654,I look forward to having the pleasure of welcoming you back in the near future.,
3196559,50012345,I like the third floor.,,80009655,Thank you once again.,
3196559,50012346,Great toiletries,,80009656,"Kind regards, Joseph Downing Guest Relations Manager",
,,,,,,
3252497,50012350,Accommodation ---SEP---,,80009660,It is nice to know that our guests are as pleased with our renovated apartments as we are.,
3252497,50012351,We stayed in one of the recently renovated apartments and everything was brand new.,80009660,80009661,"Only a couple have been completed, but another 4 are currently gutted and the refurbishment is well underway.",
3252497,50012352,Our location was excellent.,,80009662,"Once completed, all of the 2 bedroom townhouses will have new kitchens and bathrooms and there will be washer/dryers and dishwashers.",
3252497,50012353,Staff were amazing and friendly.,,80009663,The 4 courtyard 1 bedroom apartments will get a similar treatment.,
3252497,50012354,We were in a very quiet spot.,,80009664,"We have photos that show how amazing they are, but can't post them online until all is completed.",
3252497,50012355,Car park was off the street and safe.,,80009665,Thank you for taking the time to comment.,
3252497,50012356,The location is very close to town.,,,,
3252497,50012357,Walking distance to Hannan Street and all the various cafe's and restaurants.,,,,
3252497,50012358,I would definitely recommend to anyone who is looking at travelling to Kalgoorlie in the future.,,,,
,,,,,,
3229172,50012360,The perfect family holiday ---SEP---,,80009670,Thank you Sarah J for your review!,
3229172,50012361,We recently visited big 4 adventure whitsunday and had the most amazing time.,,80009671,"Our Poolview Condos which you stayed in have one of the best positions in the resort with our new waterslide park directly opposite, so glad you enjoyed your stay so much in them.",
3229172,50012362,We stayed in the 3 bedroom cabin which was very clean and spacious.,80009671,80009672,"Thank you also for your lovely comments regarding the friendly staff, facilities and gardens, we will pass these on to the team.",
3229172,50012363,We were located right near the water park so easy access to go over to the pool.,,80009673,Looking forward to welcoming you back soon for another special holiday :),
3229172,50012364,"Very friendly staff and great facilities, the gardens were also extremely well maintained!",80009672,,,
3229172,50012365,We will be back!,,,,
,,,,,,
3254640,50012370,Unique property with great service ---SEP---,,80009680,"Hi bmiller 2020, Thank you so much for the amazing review.",
3254640,50012371,The hotel was amazing.,,80009681,I agree the service is great food at The Corner Office is excellent,
3254640,50012372,Great service.,80009681; 80009682,80009682,so thank you for acknowedging that.,
3254640,50012373,The food was excellent.,80009681; 80009682,80009683,"We hope that heartbeat comes sooner than later, see you than!!",
3254640,50012374,"Great location in downtown, only a block from the 16th St mall and close to LODO.",,80009684,Stay Happy!,
3254640,50012375,The room was great - love the unique feel of the hotel and each floor having a theme.,,,,
3254640,50012376,I would stay again in a heartbeat.,80009683,,,
,,,,,,
3291717,50012380,"Poor ---SEP--- Looked ok from the outside, inside the musty,mildew smell was overwhelming..",,80009690,Thank you for your comments and Iâ€™m sorry we were less than you expected.,
3291717,50012381,"Thankfully we only had 1 night there, and left as soon as it was light.",,80009691,"If you are ever unhappy or unsatisfied, I would urge you to contact the front desk as our goal is for you to leave satisfied and pleased.",
3291717,50012382,Everything was spread out in 3 different buildings..,,80009692,We wish you safe travels and thank you for visiting Branson.,
3291717,50012383,Staff seemed very unorganized..,,80009693,"Sincerely, Jay Wilson General Manager",
3291717,50012384,We have had many trips to Branson and just thought we would give this a try on our last night there.. now we know.. never again......,,,,
,,,,,,
3276454,50012390,Good choice in downtown Moncton ---SEP---,,80009700,Thank you for your review on your recent stay with us!,
3276454,50012391,"This is a newer Residence Inn, and a notch above other Residence Inn's I've stayed in.",,80009701,"We are happy to hear you enjoyed our hotel, location and rooms.",
3276454,50012392,They offer the typical roomy Residence Inn studios and suites with every amenity required.,,80009702,We have a salt water pool at the hotel and do not use chlorine.,
3276454,50012393,Of note was how quiet the room was.,80009701,80009703,We apologize for the chemical smell as the pool deck was being cleaned at that time.,
3276454,50012394,"Even though it's downtown, and even though there were rooms full of celebrating grads down the hall, I heard nothing.",,80009704,We hope that next time you will be able to enjoy our pool.,
3276454,50012395,It must be well built with extra thick walls or soundproofing.,,80009705,We appreciate the recommendation and we hope to see you back again soon.,
3276454,50012396,A very peaceful and restful sleep in the most comfortable of beds.,,80009706,"Warm Regards, Darlene Power",
3276454,50012397,"The staff is helpful, and the complimentary continental breakfast offers lots of variety.",,,,
3276454,50012398,They have one free computer to use in the lobby.,,,,
3276454,50012399,"I did not use the pool, but it looked clean.",80009704,,,
3276454,50012400,I expect though that it may be over-chlorinated as the smell was powerful.,80009703,,,
3276454,50012401,"Parking is $12.00/night for hotel guests, with in and out privileges.",,,,
3276454,50012402,"Make sure you have the front desk validate your parking stub, and retrieve it from the machine every time you exit.",,,,
3276454,50012403,Compared to its nearby competition - the Delta and Rodd - I certainly recommend the Residence Inn.,,,,
,,,,,,
3316406,50012410,"Staff friendly, the rest not to recommend ---SEP---",,80009710,"As you mentioned, we have been renovating the hallways and just just the 5th floor but all of them.",
