  ,REVIEW SENTID,REVIEW SENT,REVIEW AUID,RESPONSE SENTID,RESPONSE SENT,RESPONSE AUID
3286764,,,,80000223,"Warm regards, David Fraser",
,,,,,,
3238778,50000280,Best Top 10 ---SEP---,,80000230,Hello Doug and Sue Thank you for sharing your experience with us on TripAdvisor.,
3238778,50000281,Spent 4 weeks travelling around New Zealand and spent most nights in holiday parks and this was by far the best in the country.,V80000231,80000231,I am very glad to hear you enjoyed your stay at our park.,
3238778,50000282,Clean tidy with lots of shade and best off all free showers.,,80000232,Kind regards,
3238778,50000283,Great location close to town with lots of room and facilities for anyone with kids.,,,,
,,,,,,
3173058,50000290,Enjoyable Stay ---SEP---,,80000240,Good Evening glenc53 Hope you are well and thank you for the review of the Trinity Wharf Tauranga.,
3173058,50000291,Very enjoyable stay pity we couldn't use the Resturant Staff were very warm and welcoming and the Accomodation was first class in its setting and comfort,80000241; 80000242,80000241,"So pleased to hear you found our Team warm and welcoming and that you enjoyed the Accommodation noting this as ""First Class"".",
3173058,50000292,There was some confusion of what we have pre ordered with the package but that was sorted,80000243,80000242,"You will definitely have to take the trip back from Rotorua to try out our restaurant next time, we would love that.",
3173058,,,,80000243,Glad we were able to sort out the slight 'glitch' on the package you booked.,
3173058,,,,80000244,Kind Regards Lee Parker Hotel Manager,
,,,,,,
3253514,50000300,Rimrock OK but watch traffic ---SEP---,,80000250,We are delighted that you enjoyed your most recent experience with us at The Rimrock Our service team has great pride in delivering WOW experiences to our guests and it is a pleasure to share your feedback with them.,
3253514,50000301,The hotel is nice and well situated on the side of the mountain with great views.,80000251,80000251,We are pleased to hear you were able to enjoy the magnificent views of the Rocky Mountains.,
3253514,50000302,"However, the traffic on Mountain Avenue dead ends just above the hotel at the hot springs and gondola.",,80000252,Remember to book direct to take advantage of our Best Rate Guarantee Program and best in class service!,
3253514,50000303,"When we were there, the road gridlocked around 5:00 pm and was impassable without a 1 1/2 hour car wait until well after 8 pm.",,80000253,"In Hospitality, Rimrock Resort Hotel Management",
3253514,50000304,We were forced to walk to town and back for dinner.,,,,
3253514,50000305,No taxis would come to the area for hear of getting stuck in the gridlock.,,,,
,,,,,,
3296386,50000310,Good location and clean ---SEP---,,80000260,Thank you very much for your kind review.,
3296386,50000311,Had 3 days here for our base for Margaret River.,,80000261,We are pleased that you enjoyed your stay and enjoyed the Margaret River Region.,
3296386,50000312,A nice casual walk to go to main town.,,80000262,We hope to see you again soon.,
3296386,50000313,Clean and tidy.,,,,
3296386,50000314,Good reverse cycle aircon.,,,,
3296386,50000315,Great pressure in shower and very hot water.,,,,
3296386,50000316,As noted doona covers probably need a wash.,,,,
3296386,50000317,Other than that a good place to stay,,,,
,,,,,,
3230615,50000320,Big 4 Golden River Holiday Park ---SEP--- Absolutely beautiful location!,,80000270,Hi Jeffs and thank you for taking the time to review our park.,
3230615,50000321,Superb Cabin !,80000271,80000271,"We're so pleased you enjoyed your cabin stay, and took the time to enjoy the beautiful Murray River, which is so easily accessed from our park.",
3230615,50000322,I'm spoilt now for any future Cabins it was amazing and so nicely presented!,80000271,80000272,We look forward to welcoming you again next time you visit Mildura.,
3230615,50000323,First class facilities and close to the Murray River for inspiring early morning walks !,80000271,80000273,"Regards, Karen",
3230615,50000324,Loved it there!!!,,,,
,,,,,,
3234079,50000330,Oldest Hotel In Denver ---SEP--- Usually an old hotel is drafty and have that old basement smell.,,80000280,"Dear Okiegnome, It was a pleasure to welcome you to The Oxford Hotel, thank you for your review.",
3234079,50000331,The Oxford was a Romantic and comfortable.,80000281,80000281,"It is wonderful to hear you found the Oxford to be a ""romantic and comfortable"" stay.",
3234079,50000332,My only regret was not booking more time Fun part of town,,80000282,We look forward to your next stay at The Oxford Hotel.,
3234079,50000333,Oh oh oh.,,80000283,"Sincerely, Brandon Daniels Hotel Manager",
3234079,50000334,I almost forgot Love the detailed architecture,,,,
,,,,,,
3227838,50000340,Better than ever ---SEP---,,80000290,Dear RTBUSMC: The staff and management of The Bellmoor would like to thank you for your recent stay and for taking the time to submit your review.,
3227838,50000341,"With the addition of the Lupo catering staff for breakfast service and the ""beach buggy"" The Bellmoor has continued to provide a first class experience.",80000291; 80000292,80000291,We have added the beach shuttle service for the summer season and look forward to continuing it for many summer seasons to come.,
3227838,50000342,We always delight in our stays at the Bellmoor.,,80000292,Our breakfast enhancements have been well received and we delight in starting our guestâ€™s day off with happiness.,
3227838,,,,80000293,Thanks again for your continued patronage and we look forward to your next visit.,
,,,,,,
3167339,50000350,"Comfortable, affordable, convenient & friendly ---SEP---",,80000300,Aloha!,
3167339,50000351,The Coconut Waikiki is a comfortable hotel conveniently located within about 15 minutes walk from Waikiki beach.,80000302,80000301,Thank you so much for sharing your experience with us.,
3167339,50000352,The staff were all genuinely very friendly and helpful.,,80000302,We're happy you enjoyed your stay with us and it sounds like you were able to take advantage of the best our hotel has to offer; the Coconut Waikiki's location right in the middle of Waikiki and the continental breakfast served in the mornings.,
3167339,50000353,The room was modern and spacious with lots of storage.,,80000303,"The next time you're looking to book a hotel in Waikiki, we hope you'll choose to stay with us again!",
3167339,50000354,The bathroom was a little cosy and the air-conditioning was quite noisy.,,80000304,Mahalo,
3167339,50000355,The self service continental breakfast (included in the room rate) was excellent with plenty of choice.,80000302,,,
3167339,50000356,"Unfortunately, the maid service didn't seem to know about the hotel's ""help us conserve"" programme so the towels were changed daily, even though we had hung them up as requested.",,,,
3167339,50000357,Our only significant gripe was the car parking - $30/night was excessive.,,,,
3167339,50000358,Excellent WiFi in the room.,,,,
,,,,,,
3215191,50000360,Fabulous stay for 50th birthday treat ---SEP---,,80000310,"Dear SunshIne561065, Iâ€™m so happy to hear you had a wonderful stay with us to celebrate this special occasion and that you enjoyed some birthday cake together!",
3215191,50000361,We chose macq01 for husbands 50th birthday as wanted something special and am so glad we did.,80000310,80000311,"A special thank you for providing feedback on your Story Telling experience, I will be sure to pass this along to the team.",
3215191,50000362,The service and hotel room was fabulous.,,80000312,"Thank you once again, Jake Smith General Manager MACq01 Hotel",
3215191,50000363,Loved the story telling walking tour with Colette that was included.,80000311,,,
3215191,50000364,The cake on arrival was a pleasant surprise.,80000310,,,
3215191,50000365,One of the best hotel experiences weâ€™ve had.,,,,
,,,,,,
3314432,50000370,Best in Town ---SEP--- Property is maintained to a very high standard.,V80000320,80000320,"Hi Bruce Thanks for taking the time to give us your feed back, so glade we are able to provide you with the quality of accommodation that suit your needs.",
3314432,50000371,Would be the best in town.,,80000321,Look forward to your next visit.,
3314432,50000372,Allan and staff are very friendly and attentive to guest requests.,V80000320,80000322,Regards Alan Lillian & Staff,
3314432,50000373,Third stay and will.,,,,
3314432,50000374,continue to stay at this accommodation whenever in town.,80000321,,,
,,,,,,
3285747,50000380,GREAT to be back ---SEP---,80000330,80000330,"Well Gary, is it 5 or 6 times now you have been back?",
3285747,50000381,it's been a number of months since i was last at the royal villa.,,80000331,We love you.,
3285747,50000382,it's only keeps getting better.,,80000332,"Thank you for the kind words and hopefully if I have enough time the next time I am in Toronto, we should get together for lunch.",
3285747,50000383,there is sun tan locations available outside the office!,,80000333,Hope to see you soon.,
3285747,50000384,the pool as inviting as ever and the hot tub ready to sooth tired muscles.,,80000334,Doug and Kenny,
3285747,50000385,"was there during phoenix pride parade and festival and the resort was full, full, full.",,,,
3285747,50000386,i was so lucky to get a last minute cancellation for a five night stay!,,,,
3285747,50000387,thanks to doug and kenny for making my stay as pleasant and enjoyable as ever!,,,,
,,,,,,
3250583,50000390,"West restaurant fantastic, hotel tired and taken over by locals ---SEP---",,80000340,"Dear Labella1, Once again, thank you for your visit and thank you for taking the time to share your recent experience.",
3250583,50000391,My partner booked two nights for our anniversary and I was really looking forward to it having read all the reviews and looked at pics.,80000341; 80000342,80000341,I am delighted to see you had high expectations prior to your arrival due to the research you did on third party review sites such as Trip Advisor.,
3250583,50000392,We had a suite with a bar in it,,80000342,"The overwhelming comments on these sites by guests who have stayed at The Twelve are namely about::- 1) how wonderful the staff are, 2) how great their dining experiences were, 3) how wonderul the atmosphere is and 4) how true the Twelve's website is to actual reality.",
3250583,50000393,"but it was structure only, had a microwave but no cutlery or plates and mini bar had no red or white wine, but for a â‚¬5 euro service charge they brought some wine.",,80000343,You can therefore understand my disappointment when we did not live up to your expectations on the latter two.,
3250583,50000394,On arrival there was a drill on one of the tables apparently someone was putting a hook on bathroom door.,,80000344,The Twelve is very much unlike the vast majority of hotels and this is why it is so well liked.,
3250583,50000395,Went for a drink in the Pins Bar to get over our long trip and providing there is no one in the bar you can get table service.,80000345,80000345,Our local bar atmosphere is an integral part of our successful formula and it is something we shout about proudly on our website.,
3250583,50000396,"Thankfully and the one thing that saved our break was the West restaurant where the food is without reservation some of the best I have ever tasted, and the wine selection amazing, would go back for the food but would probably stay elsewhere it was â‚¬199 per night that did include breakfast and our meal in The West (no wine).",80000347; 80000348; 80000349,80000346,It is this beautiful buzz which helps make The Twelve what it is.,
3250583,50000397,I had read that they had jazz in The Pins but sadly not anymore.,80000350; 80000351; 80000352; 80000353; 80000354,80000347,"Along with our staff and perfect location, the other wonderful elements are our devotion to great food and wine.",
3250583,50000398,On second day we went for a drive to explore had a lovely day but when we came back football was on and no seats in The Pins and no residents bar.,,80000348,I am delighted to see you had a terrific experience in West.,
3250583,50000399,I cannot honestly say it was a complete washout,,80000349,We have been greatly honoured with numerous accolades for West's cuisine as well as our wine list which has won pretty much every wine award there is to win.,
3250583,50000400,"but it was also not what they bill it as on their site, so by all means go, worth it for food alone but don't bother with the overpriced suites, we spent no time in the extra space as there was nothing in it.",80000342;,80000350,We do feature free live entertainment every weekend.,
3250583,50000401,I presume that the reason we had no bath in the room was because we had the bar not worth it.,80000356; 80000343,80000351,"On Fridays, it is always Traditional Irish music sessions - really good sessions.",
3250583,,,,80000352,"Saturdays, however lend thmselves to more variety.",
3250583,,,,80000353,"Sometimes it is Jazz, other times it is Blues.",
3250583,,,,80000354,We always try to mix it up and the reason for this is based upon feedback from our guests.,
3250583,,,,80000355,Our Facebook page always has the most up to the minute infomation.,
3250583,,,,80000356,There are two end suites in the hotel which were designed for guests who want walk in showers rather than a bath.,
3250583,,,,80000357,"When you book directly on The Twelve's official website, you are given the luxury of choice.",
3250583,,,,80000358,"Unfortunately, this is not possible on third party sites.",
3250583,,,,80000359,"Labella, I really wish you had given us the opportunity to make some sort of service recovery whilst you were staying with us.",
3250583,,,,80000360,Our goal is to ensure every guest has a wonderful time at The Twelve.,
3250583,,,,80000361,"Sincerely, Fergus",
,,,,,,
3316416,50000410,Funky hostel/hotel in a beautiful setting ---SEP---,,80000370,"""I am not sure if you were aware of our sign on the front desk that indicates how to get a hold of us.",
3316416,50000411,We had a room with 2 twin beds.,,80000371,"We cannot be at the front desk all the time, but we are always happy to give information about the area.",
3316416,50000412,There was a sink in the room with the beds and a bathroom.,,80000372,"Thanks for the time to write a review.""",
3316416,50000413,Showers were in the hallway.,,,,
3316416,50000414,They provided bathrobes and the showers were very clean.,,,,
3316416,50000415,We had to ask for extra pillows as the pillows were not very fluffy.,,,,
3316416,50000416,The girl gave us the last 2 pillows.,,,,
3316416,50000417,The breakfast was very basic and you had to wash your own dishes--hostel style.,,,,
3316416,50000418,The man who checked us in was not friendly and seemed distressed when I asked him for 2 keys.,,,,
3316416,50000419,No one was ever at the front desk so I never was able to get advice about the local activities and amenities.,80000370; 80000371,,,
3316416,50000420,"The common area was very nice with couches, tables in a colorful, sunny room.",,,,
3316416,50000421,The Cube is an easy walk from everything in Revelstoke.,,,,
,,,,,,
3299332,50000430,Moving Daughter ---SEP--- Great Motel clean and very comfortable spacious rooms Hotel was also great very friendly and helpful staff Would highly recommend this Motel.,,80000380,"Thank so much for a lovely review, we appreciate the kind words greatly.",
3299332,50000431,Good location easy to get to rooms are nice and quiet.,,80000381,Enjoy your travels and we hope to see you again soon.,
3299332,50000432,Breakfast available to rooms.,,80000382,"Kind regards, Sandy L.",
,,,,,,
3190936,50000440,Disappointing.,80000390,80000390,"Dear Reviewer, Thank you for taking the time to leave your review, I am sorry that we did not exceed your expectations during your recent visit.",
3190936,50000441,Would not stay again ---SEP---,80000390,80000391,"To enable us to be the best at what we do, we take customer feedback and points very seriously however we would like to inform you that the old part of this Hotel a Victorian building is due to have refurbishments in the future and had you voiced your disatifaction on arrival with the room you booked we would have endeavoured subject to availability, to upgrade you to our recently refurbished rooms.",
3190936,50000442,This hotel obviously has some lovely refurbished rooms.,,80000392,Very many thanks General Mangement Response Team,
3190936,50000443,Mine was not one of them.,,,,
3190936,50000444,"A tired, dated room with a squeaky bed that was medium-comfortable.",,,,
3190936,50000445,"The walls were full of holes from old fittings, the furniture had seen better days and the bathroom was also in need of a refurbish.",80000391,,,
3190936,50000446,Stupid wee things - the toilet roll holder hung off the wall and it fell on the floor all the time.,,,,
3190936,50000447,None of these things matter when you're asleep so a good night's sleep would have made me less critical.,,,,
3190936,50000448,My room was at the back of the hotel and quiet on the first night (bank holiday).,,,,
3190936,50000449,On the second n get there was someone in the room above me and next to me.,,,,
3190936,50000450,You could hear every footstep and the floorboards sounded like they were ready to collapse.,V80000391,,,
3190936,50000451,Every person going upstairs sounded like they were stomping in my room.,V80000391,,,
3190936,50000452,Being near reception there were voices every time someone came in.,,,,
3190936,50000453,The heating/cooling unit made a buzzing noise for a few seconds every ten mins waking up a light sleeper.,,,,
3190936,50000454,The glass and bottle brought from the 'bar' (small fridge at reception),,,,
3190936,50000455,was not cleared out of my room after the first day.,,,,
3190936,50000456,Staff were pleasant and I was asked on departure if they could do anything to help after I complained about noise.,,,,
3190936,50000457,Short of new floorboards nothing could help after the event.,80000391,,,
3190936,50000458,Breakfast ok. Staff not identified with either uniforms or badges.,,,,
3190936,50000459,Won't be back.,,,,
3190936,50000460,From the reviews there are obviously some nice rooms - perhaps on top floor wth,,,,
3190936,50000461,nobody above.,,,,
3190936,50000462,My stay was very disappointing.,,,,
,,,,,,
3275888,50000470,"Friendly, modern and central ---SEP---",,80000400,Hey moonmobile What can i say??,
3275888,50000471,I really enjoyed staying at this hotel.,,80000401,The perfect review!,
3275888,50000472,Great central location.,,80000402,Makes a rainy day in Glasgow a bit more cheerful.,
3275888,50000473,Really nice cheery modern decor.,,80000403,Thank you for posting.,
3275888,50000474,Lovely modern comfortable room.,,80000404,My best Rory,
3275888,50000475,I also liked the relaxed bar/dining room/reception area.,,,,
3275888,50000476,"Really helpful and hospitable staff, with a special thank you to Alix.",,,,
3275888,50000477,Just the right place to land after a long flight from Australia.,,,,
3275888,50000478,Highly recommended.,,,,
,,,,,,
3256074,50000480,daughters 21st ---SEP---,,80000410,Dear Nikki F Thank you so much for taking your time to write a 5* review after your recent stay at the Shankly hotel.,
3256074,50000481,Thursday 26 may we had family and friends to celebrate my daughters 21st in the eden room,80000411,80000411,I'm so pleased you chose to stay with us and celebrate your daughters 21st birthday.,
3256074,50000482,"6.30pm till 10pm, we were greeted by joe caz who looked after us all he was very professional.",80000412,80000412,"We strive to deliver first class customer service to all our guests, so well done to Joe,Sophie and Chrystal for going above and beyond t make your time spent with us more memorable.",
3256074,50000483,the 2 girls serving behind the bar Sophie and Chrystal were fantastic also.,80000412,80000413,We look forward to seeing you again soon.,
3256074,50000484,The great staff you have made our celebration the best we could of had.,80000412,80000414,Warmest wishes Emma Parry ema@shanklyhotel.com,
3256074,50000485,will definitely be back to the shankly.,80000413,,,
3256074,50000486,"my daughter and friends stayed in the themed room wardrobe sleeps 8,another 3 rooms in the hotel were booked by family which were amazing.",,,,
3256074,50000487,breakfast is best ever.,,,,
3256074,50000488,fantastic hotel thank you,,,,
,,,,,,
3314622,50000490,Easy access ---SEP--- Easy to get to and convenient to shopping and eating.,,80000420,Thank you for sharing your recent stay with us on TripAdvisor!,
3314622,50000491,Front desk staff was very friendly and courteous.,80000421; 80000422,80000421,We are so happy to hear you enjoyed your time here and that the staff took great care of you.,
3314622,50000492,"Rooms were clean the first day as you would expect but the second day, not so much.",,80000422,We take great pride in our friendly staff and the cleanliness of our hotel.,
3314622,50000493,We told the front desk and subsequent days were much better.,80000421; 80000422,80000423,Please come back and see us again soon.,
3314622,50000494,The pool area was well maintained except for the hot tub which wasnâ€™t working for the three days we were there.,,80000424,Have a Great Day!,
3314622,50000495,I hope they got it fixed by now.,,80000425,Sydney Fyke,
3314622,50000496,I always enjoy it after a day of driving.,,,,
3314622,50000497,"The breakfast, well the breakfast was very minimal at best.",,,,
3314622,50000498,It was fresh and edible but that is about it.,,,,
3314622,50000499,It seems to me they need to focus on the small details.,,,,
3314622,50000500,Overall we were satisfied and would stay here again,,,,
,,,,,,
3262437,50000510,Beyound Expectations ---SEP---,80000432,80000430,Hello Gus,
3262437,50000511,Marty's is great find.,,80000431,Our sincere appreciation for your great review.,
3262437,50000512,Perched between two beaches that are only 4 minutes walk maximum on flat pathway.,80000434,80000432,It is very rewarding when we exceed guest expectations !,
3262437,50000513,Nelsons Bay shopping centre a three minute drive or 15 min walk.,80000434,80000433,We do agree .....,
3262437,50000514,On the way you will pass the Diggers club where the meals were excellent for the price.,,80000434,our location is superb and we do take pride ion the cleanliness of our apartments.,
3262437,50000515,The rooms are spacious without being enormous.,,80000435,We would love to welcome you and your family back to stay with us again when next visiting the stunning Port Stephens area.,
3262437,50000516,We had a two bedroom with kitchenette with two adults and 3 kids and never felt short of space.,,,,
3262437,50000517,The pool is heated and very pleasant after a day out Thoroughly recommend,,,,
,,,,,,
3238614,50000520,Loved the quiet ---SEP---,,80000440,Thank you Elaine for taking the time to review your stay with us at Eagle's Nest Condo Resort.,
3238614,50000521,A bit of a drive if you're planning to do much in Branson itself.,,80000441,We are glad to learn that you had a wonderful time and hope you will visit us again soon!,
3238614,50000522,"As Michigan natives, we aren't used to the winding roads and hills of the Ozarks.",,,,
3238614,50000523,Glad we had our brakes taken care of before we went on this trip!,,,,
3238614,50000524,But the view from the balcony was wonderful.,,,,
3238614,50000525,The kitchen and laundry area were compact but had everything necessary so we could fix breakfast and lunch and even have some friends over.,,,,
,,,,,,
3326975,50000530,Large rooms and good breakfast ---SEP---,,80000450,Thanks for the great review and feedback.,
3326975,50000531,We had two rooms that they conveniently put next to each other.,,80000451,We are so happy to hear you had a great stay and look forward to welcoming you back in the future.,
3326975,50000532,"Very large rooms, clean and comfortable.",,,,
3326975,50000533,Large bathrooms which were very clean with large walk in showers.,,,,
3326975,50000534,This is a newer hotel so everything was in great condition.,,,,
3326975,50000535,"Complimentary breakfast buffet had a decent amount of choices of cold and hotel food, 2 waffle machines and fresh cut up fruit.",,,,
3326975,50000536,Friendly and helpful staff when I called to get a last minute reservation as it was almost full.,,,,
3326975,50000537,I would definitely recommend this hotel and would stay there again.,,,,
,,,,,,
3295796,50000540,Dated Room - Service was Spotty ---SEP---,,80000460,"Dear PaulusHookJC, Thank you for taking the time to review your stay at Hilton Glasgow.",
3295796,50000541,Positives: - Women at front desk were expedient and friendly.,80000461,80000461,"While I am happy to hear your feedback on the friendly service from our front desk team, nice view from your room and delicious scallop starter, I am sorry to read there were some areas mentioned in your review that prevented you from having an overall positive experience with us.",
3295796,50000542,-,,80000462,"As with all Tripadvisor reviews your comments have been shared with our team, in particular, our Food and Beverage Manager.",
3295796,50000543,My room was on the 15th floor and had a nice view.,80000461,80000463,Your feedback will be included as part of our on-going review of products and services we offer our guests.,
3295796,50000544,-,,80000464,All forms of feedback are invaluable in ensuring we maintain our high level of service and standards and I do hope that we will have the opportunity to welcome you back to the hotel in the near future.,
3295796,50000545,My scallop starter at dinner was very delicious.,80000461,80000465,"Kind Regards, Lisa",
3295796,50000546,-Good water pressure and large towels in shower.,,,,
3295796,50000547,- Taxis were always available out front.,,,,
3295796,50000548,Negatives: - Room was not updated and felt like an old Holiday Inn.,V80000461,,,
