  ,REVIEW SENTID,REVIEW SENT,REVIEW AUID,RESPONSE SENTID,RESPONSE SENT,RESPONSE AUID
3189210,50012673,Staff were super friendly and welcoming.,80009841,,,
3189210,50012674,Rooms and bathrooms clean and bedroom spacious.,,,,
3189210,50012675,Our room on the higher floor gave us a beautiful view of city and harbour!,,,,
3189210,50012676,Price was as expected for a nice downtown Auckland hotel.,,,,
3189210,50012677,Easy walk to major department store and shopping.,,,,
3189210,50012678,Room service and restaurant in hotel have a very tasty menu and great service.,,,,
3189210,50012679,Also hotel is right next door to two wonderful Auckland eateries!,,,,
,,,,,,
3222013,50012680,Brilliant stay at Aqua ---SEP---,,80009850,What a wonderful review - thank you so much.,
3222013,50012681,"This is my family's fifth visit to Aqua having stayed in the 4 bedroom single storey villas and, more recently, the double storey villas at the front of the property.",,80009851,We are so pleased to announce that we were just awarded the Hall Of Fame for 2018 for our consistent wins of the Certificate of Excellence!,
3222013,50012682,The facilities are great and the accommodation works wonderfully well for all groups whether large or small.,,80009852,Look forward to seeing you again soon.,
3222013,50012683,And the 100m or so walk to the beach for a swim or to catch some fish just tops it all off.,,80009853,"Warm Regards, Jane.",
,,,,,,
3251261,50012690,"Yarra Gables ---SEP--- Proprietor was very welcoming, service was great, beautifully set out rooms attention to detail was exellent.",,80009860,Hi Very pleased that you enjoyed your stay.,
3251261,50012691,Would not hesitate to recommend a visit.,80009861,80009861,Thank you for a great review and thank you for recommending us.,
3251261,50012692,Beautiful garden settings quiet and relaxing would have liked to stay longer.,,80009862,We look forward to welcoming you back.,
3251261,50012693,Look forward to visiting again.,,80009863,Ralph,
,,,,,,
3233447,50012700,"Clean, comfortable, good restaurant ---SEP--- Stayed there on night but found the room very clean and comfortable.",,80009870,"Dear Joseph N, Thank you for your recent feedback.",
3233447,50012701,"The restaurant is also ok - simple food, nothing spectacular.",,80009871,I am pleased to read that you found our location convenient for your recent stay.,
3233447,50012702,"Overall, it is a very good solution if you have an early morning flight due to its position.",80009871,80009872,"Kind Regards, Amy",
,,,,,,
3229502,50012710,2 week business stay ---SEP---,,80009880,"Dear Amanda M, Thank you for the wonderful remarks for our staff.",
3229502,50012711,Brittany and Carlos both provided excellent customer service!,80009881; 80009882,80009881,Brittany and Carlos are definitely an asset to our team.,
3229502,50012712,They were very friendly and made my stay very enjoyable.,80009881; 80009882,80009882,They will be thrilled to know that they made your stay more enjoyable.,
3229502,50012713,I enjoyed the pool everyday I was there.,,80009883,Our Coast Restaurant does an amazing job and I am so happy that you enjoyed your dining experience.,
3229502,50012714,"The restaurant had excellent food, especially the carb cakes!",,80009884,I hope that you will visit us again soon.,
3229502,50012715,"However, breakfast was a little pricy.",,80009885,Silvana G. - Guest Service Manager,
,,,,,,
3223771,50012720,Best 5 days in my life ---SEP---,,80009890,Hey Linnr742!,
3223771,50012721,I went on the camp with a friend and left the camp with like 10 new friends.,,80009891,Thank you so much for your awesome review!,
3223771,50012722,Everyone there is super friendly so even if you are travelling alone..it won't matter when you get there.,,80009892,Meeting great new people is one of the most important things and we are happy that we were able to become one of yours.,
3223771,50012723,"And a big plus is the instructors, very friendly and good looking.",80009894,80009893,Hope to see you again to chill out together.,
3223771,,,,80009894,We hire our intructors only if they are TERRIFIC!,
3223771,,,,80009895,"If you havenâ€™t already, donâ€™t forget to collect your free tee and hat at the Rip Curl Store in Market Street!",
3223771,,,,80009896,Cheers mate!,
3223771,,,,80009897,Surf Camp Staff,
,,,,,,
3269314,50012730,"Clean, Honest Accommodation ---SEP---",,80009900,Thank you for taking the time to leave a review.,
3269314,50012731,The package we had was just right for our stay in Adelaide.,,80009901,I'm glad you enjoyed all the value adds.,
3269314,50012732,"Location, location, location close to beach, Tram to CBD, shopping and airport.",,80009902,We have plans for the refurbishment of the foyer and other public areas which we are excited to see roll out.,
3269314,50012733,Although tired and the foyer was really sad and off putting the staff were friendly and efficient.,80009902,,,
3269314,50012734,The rooms had been refitted and were clean and the bed was comfy.,,,,
3269314,50012735,Included in the price was a continental breakfast which was enough to get you started for the day.,,,,
3269314,50012736,Views from the upper rooms were great and worth the extra cost.,,,,
3269314,50012737,Parking was free next door to guests with a very short walk to front door.,,,,
3269314,50012738,Hooray!,,,,
3269314,50012739,the wifi was free and works not like some places.,,,,
3269314,50012740,Across the road was a fantastic Buffet that is a must for those who like a value meal and if you need a treat the Orange Spot Bakery next to the hotel is dangerous to weight watchers.,,,,
3269314,50012741,Will use this hotel again as it represents value for money.,,,,
,,,,,,
3168994,50012750,Another Excellent Stay ---SEP---,,80009910,"Dear The Dude Enfield, Thank you for choosing to stay with us at the Imperial Hotel.",
3168994,50012751,My wife and i stayed here as we were meeting friends in Cork.,,80009911,We are delighted that you enjoyed your stay with us and thank you for taking the time to write such favourable comments on trip advisor.,
3168994,50012752,"We went to the reception at around 11am to see if we could leave our luggage but the room was ready for us, which was excellent.",,80009912,We look forward to welcoming back to the Imperial Hotel soon.,
3168994,50012753,We had a family room on the first floor which was large and spacious.,,80009913,"Best regards, Anne Anne O'Leary Operations Manager",
3168994,50012754,The only downside was when you flushed the toilet there would be an uneartly whine until the water filled in.,,,,
3168994,50012755,The beds are very comfortable and the staff are very friendly as one would expect.,,,,
3168994,50012756,It is rather old fashioned,,,,
3168994,50012757,but I like the character of the place.,,,,
3168994,50012758,The breakfast is delicious and you have a choice of fried or poached eggs made for you.,,,,
3168994,50012759,It is in an ideal location in the centre of town.,,,,
3168994,50012760,We shopped around and got the bed and breakfast cheaper on a 3rd party website which unfortunately the hotel couldn't match.,,,,
3168994,50012761,Next we go to Cork we will definitely be staying at the Imperial.,,,,
,,,,,,
3189350,50012770,Spacious and modern apartment - park view with norfolk pine trees ---SEP---,,80009920,Many thanks for taking the time to comment on your recent stay at Oaks Plaza Pier.,
3189350,50012771,This apartment seems larger than usual as you can close off the bedroom with sliding doors and watch TV in there.,80009921,80009921,We are pleased to hear that you found your apartment to be large with a good size balcony to take in the beautiful views.,
3189350,50012772,There is also a good sized balcony which catches the morning sun.,80009921,80009922,We hope to welcome you back again soon next time you are visiting Glenelg.,
3189350,50012773,"The kitchen is well-equipped with a dishwasher, microwave and oven and there is also a washer/dryer.",,,,
3189350,50012774,There are three restaurants downstairs (owned separately from the apartments so there is no room service).,,,,
3189350,50012775,"The pool is good, also, but quite cold.",,,,
3189350,50012776,As mentioned by other reviewers the staff are not friendly.,,,,
3189350,50012777,"The apartments are built on the beach, close to the Beachouse (full of fun for kids) and Jetty Road, the main shopping drag.",,,,
3189350,50012778,It's lovely to walk along the beachfront and if you are a history buff take a look at the Bay Discovery Centre in Molsley Square (Glenelg Town Hall - no entry fee).,,,,
3189350,50012779,The tram runs from Molsey Square straight into the city regularly.,,,,
,,,,,,
3174996,50012780,"Great skyline view, comfortable beds ---SEP---",,80009930,"Dear Fearless30792709540, Thank you for your review and for choosing One King West.",
3174996,50012781,This was possibly the most comfortable hotel bed I've ever slept on.,80009931,80009931,I am glad to hear that overall your experience was an enjoyable one and that our modern comfortable suites were instrumental in making your stay an enjoyable one.,
3174996,50012782,"Beware staying in a room on upper levels, while the view is beautiful, the elevators may mean you're waiting for quite a while, but just adjust your schedule on busy mornings and enjoy the view",80009933; 80009934,80009932,We strive to be the hotel our guests call home and it is always rewarding to hear that our efforts have been recognized and appreciated.,
3174996,,,,80009933,Thank you for letting us know about your experience with the elevators during your stay.,
3174996,,,,80009934,We are aware of this issue and are looking for ways to resolve it.,
3174996,,,,80009935,"Again, thank you for your review and I look forward to welcoming you back in the future.",
3174996,,,,80009936,"Regards, Steve O'Brien General Manager",
,,,,,,
3164910,50012790,Best place on the east coast!,,80009940,"HAHA, thanks nickw658, Sorry about testing your primate abilities, we're just launching the new lock system, and there's obviously been a few hiccups.",
3164910,50012791,---SEP---,,80009941,"Hopefully it didn't ruin your stay, I'll make sure Jolanta gets some love for making sure your stay was great.",
3164910,50012792,I checked into Base twice when I was Airlie Beach and greeted by the amazing Jolanta on both occasions who was a super helpful receptionist who went well out her way and beyond duties to help me on many occasions and make my stay comfortable.,80009941,80009942,"Hope the rest of your travels are amazing Cheers, Tom",
3164910,50012793,"Shed bar is an awesome atmosphere, the pool is lush, the rooms are the perfect temperature and the beds comfortable.",,,,
3164910,50012794,My only criticism is the locks.,80009940,,,
3164910,50012795,Getting in is like trying to defuse a bomb.,,,,
3164910,50012796,I felt like an Orangutan trying to finger paint... ask for a key card ;),80009940,,,
,,,,,,
3276077,50012800,Convienient ---SEP---,,80009950,"Dear hoperp, Thank you for taking the time to review our hotel following your recent stay with us.",
3276077,50012801,A modern easily accessable hotel adjacent to Heathrow T5.,,80009951,"I am thrilled to know that you enjoyed the convenience of our location, also you were impressed with our soundproofing despite the fact that we are connected to terminal 5 via a covered walkway.",
3276077,50012802,"No need to step outside, direct access by lift and dedicated walkway.",,80009952,"Thank you again for choosing the Sofitel London Heathrow, we look forward to welcoming you back in the near future.",
3276077,50012803,"Rooms were quite spacious, clean and very quiet no aircraft noises",80009951,80009953,"Yours Sincerely, James Berry â€“ General Manager Sofitel London Heathrow",
3276077,50012804,despite the fact it is so close to the airport and T5.,80009951,,,
,,,,,,
3307946,50012810,Awful Experience with Front Desk Staff ---SEP---,,80009960,We apologize for the experience and the matter is being looked into and the staff will be corrected.,
3307946,50012811,I stayed here on business 6/24-6/25/2019.,,80009961,We do appreciate the feedback.,
3307946,50012812,It's budget hotel and my expectations weren't especially high,,,,
3307946,50012813,"so I didn't take issue with the super low-flow shower pressure, loud A/C or lukewarm breakfast buffet and coffee.",,,,
3307946,50012814,What drove me to write this review was the absolutely awful customer service I received from the front desk manager on the night of 6/24.,,,,
3307946,50012815,I dropped off laundry monday am and was told it would be back in my room 6-7pm.,,,,
3307946,50012816,When I returned at 7:30 it wasn't there,,,,
3307946,50012817,so I called down to the front desk and was told that they didn't have my clothes and I should call the dry cleaner.,,,,
3307946,50012818,"When I explained that she's the one who should call the dry cleaner, she hung up on me.",,,,
3307946,50012819,"After 3 unanswered calls to the front desk, she finally answered to tell me my clothes never went to the dry cleaner and they were at the front desk.",,,,
3307946,50012820,"When I was asked for an explanation as to why this happened, she told me that she would have to get back to me and hung up.",,,,
3307946,50012821,She never called me back and 5 calls to the front desk went unanswered before I had to go down to the front desk myself.,,,,
3307946,50012822,"At the front desk i was handed my clothes and offered no apology or explanation, in fact the front desk manager said absolutely nothing.",,,,
3307946,50012823,How do people like this get jobs in the hospitality business and how does Holiday Inn/IHG let them slip through the cracks?,,,,
,,,,,,
3190697,50012830,Location is horrible ---SEP---,,80009970,Thank you for taking the time to give us some feedback regarding your stay.,
3190697,50012831,We're here in Denver to attend a conference.,,80009971,I am sorry you were disappointed with our location.,
3190697,50012832,Downtown Denver is pricey so we stayed here for a more reasonable price.,,80009972,We are located in an industrial area right off the highway.,
3190697,50012833,"Long story short, pay the extra to stay elsewhere.",,80009973,"While it is not convenient for walking we are just 10-15 minutes from so many great places in Denver including Coors Field, Pepsi Center, Elitch Gardens, National Western Complex, Union Station and many more.",
3190697,50012834,This hotel is near NOTHING.,80009971; 80009973,80009974,"Compared to Downtown Denver's high hotel and parking prices, we are a great value.",
3190697,50012835,U can't walk to anything.,80009971; 80009973,80009975,We do offer our shuttle for guests that do not have a car.,
3190697,50012836,"Half of our room plugs don't work, lamp doesn't work, tap in kitchenette also doesn't work.",,,,
3190697,50012837,"Internet is painfully slow, like dial up kind of bad.",,,,
3190697,50012838,"There are a couple positives - they offer shuttle service to quite a few locations, including several places downtown and the airport.",80009975,,,
3190697,50012839,They also have a pool here.,,,,
3190697,50012840,"Aaaand, that's about it.",,,,
3190697,50012841,"If you're looking to find a reasonably priced hotel, search for hotels about 20 mins outside of the city but located in populated areas so that you have somewhere to eat or possibly shop.",,,,
3190697,50012842,Closest place to buy beer is a 20 min walk away.,,,,
3190697,50012843,"Having said all this, if you're driving here, these may not be as much of an issue, but for anyone flying here without a vehicle, definitely choose a different location.",,,,
,,,,,,
3299731,50012850,Staying at this hotel feels like staying with family!,,80009980,"DSav, You said you can't say enough positives about it - I'll give that two thumbs up!",
3299731,50012851,---SEP---,,80009981,A great review to read and it sounds like our staff went way above and beyond your expectations for your stay.,
3299731,50012852,My sisters and cousins held a reunion in Denver and stayed at this hotel.,,80009982,I'm very happy that you all had such a great time.,
3299731,50012853,We can't say enough positives about it!,80009980,80009983,"When it's your turn to plan the next reunion, I hope you'll pick us again!",
3299731,50012854,"The hotel shuttle from the airport was convenient, friendly, and on time.",,,,
3299731,50012855,The rooms were clean and well-maintained.,,,,
3299731,50012856,The breakfast buffet had better-than-average selections and a friendly staff that tried hard to please.,,,,
3299731,50012857,"Each day the management provided a reception from 5-7 with free beer, wine, soda, crackers, cheese, nibbles, and, one afternoon, hot hors doerves.",,,,
3299731,50012858,"The pleasant breakfast room always had fresh coffee, teas, and fruit, so when we weren't out on the town, our group enjoyed using it for cards and conversation.",,,,
3299731,50012859,"During our stay our rental car malfunctioned, and the staff pitched in with tools to try to fix the problem; when that didn't work, the staff pulled strings to expedite a replacement vehicle nearby.",80009981,,,
3299731,50012860,"Overall, we felt like like we were staying with family!",,,,
,,,,,,
3324675,50012870,nice place to stay ---SEP---,,80009990,Dear Phil T Thank you for taking the time to share your comments on Tripadvisor following your recent stay with us at the Sligo City Hotel.,
3324675,50012871,We stayed here by chance.,,80009991,We are delighted that you enjoyed your stay with us here and also that we were recommended to you.,
3324675,50012872,"We weren't planning on staying in Sligo, but the city's charm held us.",,80009992,We look forward to seeing you back with us very soon Trevor Canning General Manager,
3324675,50012873,"We asked where to find a clean, convenient, reasonably priced room and several people recommended this hotel.",,,,
3324675,50012874,"We were very pleased, and would stay here again.",,,,
,,,,,,
3193557,50012880,Bussiness ---SEP---,,80010000,"Thank you Shebusybee for your review, our apologies for the delayed response as we have been on a short break.",
3193557,50012881,The service here is always amazing.,,80010001,It has been our pleasure to welcome you and all of your staff to the Altitude for the past 4 years.,
3193557,50012882,We have stayed here four years running.,80010001,80010002,We look forward to welcoming you all back again next year.,
3193557,50012883,Consistent is the word for this Motel.,,80010003,Take Care and thank you again.,
3193557,50012884,"Always and still greeted with a smile, rooms utensil etc always clean.",,80010004,"Kind Regards, Bruce and mary",
3193557,50012885,You will not find fault here!,,,,
3193557,50012886,Even the sharp knives are sharp....you can slice your tomatoes no worries.,,,,
3193557,50012887,We stay in plenty of places and the knives are always blunt.,,,,
,,,,,,
3260662,50012890,Spa weekend ---SEP---,,80010010,"Dear Nead22, Thank you for taking the time to review our hotel and for your kind words with regards the hotel and dÃ©cor.",
3260662,50012891,Fab hotel and fab decor.,80010010,80010011,I am delighted that you enjoyed your breakfast and dinner experience.,
3260662,50012892,We had lovley room with a nice view.,,80010012,I was disappointed to hear that you found that the 'make-up wasn't anything special' and that you found that your spa treatments were missing something.,
3260662,50012893,The breakfast and dinner was enjoyable.,80010011,80010013,I will make sure your feedback is passed onto the spa team .,
3260662,50012894,"We booked in for hair,make-up and spa treatments.",,80010014,"I do hope to welcome you back to the hotel , it has been completely refurbished since your last visit.",
3260662,50012895,The hair was lovley.,,80010015,Kind Regards John O'Malley,
3260662,50012896,The make-up wasn't anything special.,80010012,,,
3260662,50012897,The spa treatments were nice but out of 7 girls we all agreed it was missing something.,80010012,,,
3260662,50012898,We couldn't relax fully for some reason!,,,,
3260662,50012899,Would still stay here again but wouldn't use the spa facilities again,,,,
,,,,,,
3262772,50012900,Cold ---SEP---,,80010020,"Hello Ian, Thank you for visiting Mantra Lorne.",
3262772,50012901,"Room was cold and heater didnt work very well and was noisy all night, room was dirty and they couldnt tell us if we could park our car close to our room as there is limited parking around the rooms.",V80010021,80010021,"Your feedback has been shared with the team and will assist us in targeting areas for improvement, so thank you for sharing your experience.",
3262772,50012902,Was not very impressed,,80010022,Cheers Abraham,
,,,,,,
3263247,50012910,Facility was great.....food not so much ---SEP---,,80010030,"Hi Fred, Thank you, you contacted me directly and I have responded to you, again I am sorry that you were so disappointed.",
3263247,50012911,"We are annual visitors to LBLR, one of our favourite mini holiday destinations every year.",,80010031,"We will be pleased to welcome you back, on your next visit.",
3263247,50012912,"The usual creature comforts were at their usual high standard but, this trip, the food disappointed.",,80010032,"Best wishes, Tim Hackett",
3263247,50012913,"On Friday, 15FEB2019, dinner was inedible.",,,,
3263247,50012914,"Didn't have the heart to bother the server, a delightful young man from Oakville, who was a pleasure to deal with.",,,,
3263247,50012915,"Not sure who was chef that night, but my ling cod and shrimp were so oversalted that 3 bites was all I could manage.",,,,
3263247,50012916,"These seafood choices are subtly flavoured, requiring a deft touch with seasonings.",,,,
3263247,50012917,Dinner was a bust as a result.,,,,
3263247,50012918,My wife was less than enamoured with her food as well.,,,,
3263247,50012919,"We'll be back, but the great room may be for morning coffee and a newspaper.... dinner not so much.",,,,
3263247,50012920,"Fred Pinnock, North Vancouver",,,,
,,,,,,
3275265,50012930,"gorgeous dog-friendly boutique hotel, just remember your earplugs!!!",,80010040,"Dear TheFoodie8, Many thanks for taking the time to leave your review; all of your comments have been taken on board.",
3275265,50012931,---SEP---,,80010041,I'm very glad we were able to accommodate your dog on your family trip and I'm happy to hear that you enjoyed the location and decor of the hotel and the breakfast on offer.,
3275265,50012932,"I really recommend it as a hotel that allows dog, that was our priority, to find a nice mid-high range hotel that would allow dogs, and for that reason it fitted the bill.",,80010042,I'm very saddened to hear that you did not receive the high level of service from some of our staff that we usually pride ourselves on.,
3275265,50012933,"Our priority for this family trip was to bring our dog so we searched high and low for a hotel that allowed dogs, most of them were fully booked but luckily Abbey Hotel still had 2 rooms available.",80010041,80010043,I can only apologise; your issues have been raised and we will look to ensure that incidents like these do not happen again.,
3275265,50012934,The dogs are not allowed to stay on the top floor so if you bring a dog you will be given either a basement room or on 2nd and 3rd floor.,,80010044,I'm also sorry to hear that you lost sleep due to noise during your visit.,
3275265,50012935,"UNFRIENDLY FRONT OF HOUSE STAFF So apart from a staff member called Luke who assisted us with dog-friendly recommendations, most of the staff were pretty unfriendly.",80010042,80010045,We hope that you will come back and visit us again in the future and we hope to provide you with our usual better level of service next time.,
3275265,50012936,As you walked passed the reception they would be occupied amongst themselves and not really acknowledge you.,80010042,80010046,"Kind regards, Andrew Foulkes, General Manager",
3275265,50012937,When you did go up to ask a question they were quite blase about answering.,80010042,,,
3275265,50012938,They were generally fine but just don't expect 4-5* service from them.,80010042,,,
3275265,50012939,The least friendly and most abrasive was probably the female restaurant manager.,80010042,,,
3275265,50012940,"It wasn't quite the tone or attitude I would expect of someone manager a hotel restaurant, especially one that is popular like this one.",80010042,,,
3275265,50012941,DON'T FORGET EARPLUGS,,,,
3275265,50012942,"This is a hard one, it's just unfortunate that the building is very old (although nicely renovated and decorated), so you hear EVERY SINGLE footstep.",,,,
3275265,50012943,"Now we took 2 rooms, one on the top floor and one in the basement, and we all lost sleep due to the noises of people running up and down the stairs, walking through the hotel and through the lobby...",80010044,,,
3275265,50012944,This was quite a let down for us because apart from that the hotel is very well decorated.,,,,
3275265,50012945,Just be prepared with your earplugs I'd say.,,,,
3275265,50012946,The breakfast is quite worth getting it's Â£15 for a hot breakfast (I took the delicious full English breakfast),,,,
3275265,50012947,"and then there is the buffet with the usual suspects (croissants, fruit juice, fruit, yoghurt, ham, cheese).",,,,
3275265,50012948,GREAT LOCATION,,,,
3275265,50012949,"If you don't drive or prefer not to take the car, this is the perfect hotel as far as location is concerned.",,,,
3275265,50012950,"It's walking distance from the Roman Baths, all the shops and pubs too.",,,,
,,,,,,
3182065,50012960,"Escape into classy, luxurious indulgence ---SEP---",,80010050,Barbara - What a lovely review of your stay with us here at Terragong - your kind words are very much appreciated and we're so pleased to read that you had a memorable time with us!,
