  ,REVIEW SENTID,REVIEW SENT,REVIEW AUID,RESPONSE SENTID,RESPONSE SENT,RESPONSE AUID
3287424,50000000,Beautiful views and convenient location ---SEP--- Our family of 4 had a lovely one-night stay.,80000001,80000000,"Dear ClaireJourneys, Thank you for taking the time to review your stay at Balgownie Estate.",
3287424,50000001,We stayed in a 2BR unit which had stunning views of the valley.,,80000001,It is great to see that you were able to enjoy a family getaway with us at the Estate.,
3287424,50000002,It was quite spacious and comfortable.,,80000002,We are working towards renovating all our rooms at the Estate to keep them fresh and appealing for all guests during their stay.,
3287424,50000003,I will add that the dÃ©cor seemed a bit worn.,80000002,80000003,I have also passed your kind words on to our Rae's Restaurant after you enjoyed your meal with us.,
3287424,50000004,We had a very pleasant check-in and were impressed by the woman at reception who was managing two surly guests with grace while we waited.,,80000004,We hope to welcome you and your family back for another visit soon.,
3287424,50000005,The complaints we heard were ridiculous and she was so composed.,,80000005,Kind Regards Charlotte,
3287424,50000006,She checked us in quickly and in a friendly manner.,,,,
3287424,50000007,We enjoyed a the walking trail around the property and our teen girls liked the giant chess game on the lawn.,,,,
3287424,50000008,"We had dinner at Rae's, which was delicious and allowed for an incredible view as well.",80000003,,,
3287424,50000009,The estate is well located near wineries and the chocolatier and was a easy drive to our early balloon flight.,,,,
,,,,,,
3173251,50000010,Very good hotel ---SEP--- Stayed here for work for one night.,,80000010,Hello KatMcP,
3173251,50000011,"Staff were extremely friendly, greeting me as I got out of the lift (reception is on 1st floor) and asking lots of genuine questions about why I was there and how they could help.",,80000011,"Firstly, great to hear your room was super clean, ill let the housekeeping team and Klaudia know( they probably read this as they all do) Some of our rooms are a bit of a weird shape its true, this is due to the nature of the building and as such we have tried to make the most of natural light and the space itself.",
3173251,50000012,"Room was possibly the cleanest I have ever stayed in, but didn't' appear to have a window until I found it hidden behind a wardrobe in the small alcove at the back right of the room.",80000011,80000012,We are a square building,
3173251,50000013,Even then it only overlooked a small light well about 12 foot wide but which was so tall I couldn't actually see sky/the weather at the top!,80000011,80000013,"so yes, some rooms look onto others, these internal rooms are the favourites of the ""in the know"" guests who like a deep sleep as they are silent.",
3173251,50000014,"Weirder still you look straight into other rooms which made me close the curtains to my room despite it only being mid afternoon, so there was essentially no window in the room.",80000013; 80000014,80000014,You can always draw the net curtain for privacy while still allowing for natural light.,
3173251,50000015,"This is my only criticism, and a fairly minor one at that.",,80000015,Sounds like everything else was peachy though.,
3173251,50000016,Decor is quirky but functional and the free breakfast is plentiful and tasty.,,80000016,God times.,
3173251,50000017,"Location is excellent, just a few minutes from both main train stations and a few steps from the shopping and most main areas.",,80000017,My best Rory,
3173251,50000018,I had a good nights sleep and really appreciated the USB socket next to the.bed for phone chargers!,,,,
,,,,,,
3190331,50000020,Fabulous****** ---SEP---,,80000020,Hi Jo Great to hear your stay,
3190331,50000021,What an excellent experience.,80000021,80000021,"we us was a great experience, that lets us know we are going in wright direction.",
3190331,50000022,"Really comfortable clean rooms, very affordable, great location, very friendly staff.",,80000022,Cleanliness and making our guest as comfortable as possible is what we love to here Thank you Jenny and Tony,
3190331,50000023,Its a credit to Tony and Jenny (Owners) they could not do enough for us.,80000022,,,
3190331,50000024,"Great idea supplying crockery and cutlery in the rooms, I spoke to the staff that we only needed towels and not to clean the room, came back and the room was spick and span, I would highly recommend this Motor Inn to anyone Well Done!!!!",80000022,,,
,,,,,,
3161232,50000030,Comfortable Three night stay ---SEP---,,80000030,"WOW, sounds like we ticked all the boxes!",
3161232,50000031,"While the hotel could do with some modernising and re-furnishing, the service and customer management is excellent.",,80000031,"We are glad you had a fabulous time, and look forward to hosting you again soon.",
3161232,50000032,At check in it was noticed that we weren't on the same floor as our friends and this was resolved with ease and no request from ourselves.,,,,
3161232,50000033,The same service and efficient/ effective management was provided when we had an issue with our room and a new room was promptly provided.,,,,
3161232,50000034,"Great location, great staff & access to everyday amenities.",,,,
3161232,50000035,Worth getting a pool access room!,,,,
3161232,50000036,Nice views of marina and excellent value.,,,,
,,,,,,
3271710,50000040,Fabulous location ---SEP---,,80000040,Thank you for taking time to provide feedback on your recent stay.,
3271710,50000041,I really enjoyed this hotel.,,80000041,"It is pleasing to hear that you really enjoyed your stay with us, along with our unbeatable location with Narrabeen Beach on one side and Narrabeen Lake on the other.",
3271710,50000042,It was a surprising find at the end of a very busy and long day.,,80000042,"Furthermore, it is great to hear you had a great nights sleep in our comfortable beds, and found our team to be friendly and helpful.",
3271710,50000043,"Great surrounds - lake on one side, a beach on the other, with friendly and helpful staff.",80000041; 80000042,80000043,We look forward to the opportunity of welcoming you back again in the future.,
3271710,50000044,The bed was so comfortable too!,80000042,80000044,"Kind regards, Anita Reskov Front Office & Reservations Manager Quality Hotel Sands",
,,,,,,
3319214,50000050,Poor service ---SEP---,,80000050,Dear JaneyJane I am sorry to hear that we did not get the service right during your stay and I will discuss your feedback with the team.,
3319214,50000051,A contemporary hotel with great rooms which was unfortunately let down by very slow service both at dinner and breakfast on the two nights we stayed.,80000050,80000051,We want to considered great in everything we do.,
3319214,50000052,We had to request toast 3 times one morning and when it eventually came it was without butter!,80000050,80000052,Best wishes Lynn,
3319214,50000053,They appeared to not want to serve more than 1 glass of fruit juice per person either.,,,,
3319214,50000054,On Saturday evening it was busy so we expected a wait,,,,
3319214,50000055,"but it was about an hour each between the starter, main and dessert and even then they forgot the extras we had ordered.",80000050,,,
3319214,50000056,Sunday night was much quieter but alas we still had the same problems.,,,,
3319214,50000057,The food when it eventually came was very good.,,,,
3319214,50000058,We ordered cocktails but they had run out of cocktail glasses in which to serve them in.,,,,
3319214,50000059,Not quite the same having a cosmopolitan served in a brandy glass!,,,,
3319214,50000060,The staff appeared to lack training on what constitutes good customer service.,80000050,,,
3319214,50000061,"Housekeeping brilliant, as was reception.",,,,
3319214,50000062,The hotel has the potential to be a great hotel but just needs to address the restaurant problems and get the basics,80000050,,,
3319214,50000063,right,,,,
,,,,,,
3303988,50000070,Excellent hotel stay in-,,80000060,"Thank you, JM W. You point out a very important tip when it comes to booking and we thank you for your thoughtful feedback.",
3303988,50000071,well positioned and good service ---SEP---,,80000061,"We are delighted to hear you enjoyed our central location, Empire views and breakfast at fabrick.",
3303988,50000072,Staying with family during a full week.,,80000062,We hope to see you at Archer the next time you are in New York.,
3303988,50000073,"The hotel is very well positioned if you want to visit New York - near time square and all the metro, but not with the noise of the street.",80000061,80000063,"In Hospitality, Michele Mangino - General Manager",
3303988,50000074,"You should take ""empire rooms"" which are a bit more expensive, but with direct view on Empire State Building.",80000061,,,
3303988,50000075,Price is acceptable (lower than all others hotels around with similar quality).,,,,
3303988,50000076,"If you stay long, the hotel offers a discount ( nice when staying for a week or more visit).",80000060,,,
3303988,50000077,"To have this discount, I recommend you book directly on the web site of the hotel (not with agencies which do not give you the discount)",80000060,,,
3303988,50000078,Good restaurant in the hotel for breakfast.,80000061,,,
3303988,50000079,"Good bar at the 22nd floor (but not with your child, as they are not allowed if they are below 21 - NYC law)",,,,
3303988,50000080,"A bit too ""hype"" during the week, so not recommending the restaurant for dinner as overcrowded and noisy and not available without reservation.",,,,
,,,,,,
3247010,50000090,Amazing location ---SEP---,,80000070,"Dear Thiago A, What a wonderful review!",
3247010,50000091,"The hotel is really well located in the city center, 10 minutes walking from all major attractions and right in the end of high street.",,80000071,I am thrilled to see that you enjoyed your stay with us and we hope to see you again in the very near future.,
3247010,50000092,"Also really close to the train/bus station, like 8 minutes walking.",,80000072,It is reviews like this which shows that all of our hard work does not go unnoticed.,
3247010,50000093,We had a great customer service at the bar (Jonathan was great and really friendly).,80000073,80000073,"I will be sure to pass your comments on to all of the team, especially Sandra & Jonathan who I know will be so pleased.",
3247010,50000094,In the reception Sandra was very polite and helpful with city tips and all...,80000073,80000074,"Kind Regards, Conor Flynn Operations Manager",
3247010,50000095,Food is really well served - portions were surprisingly big.,,,,
3247010,50000096,The room followed the Jury's standard (really comfortable and cozy).,,,,
,,,,,,
3161840,50000100,On Way to Excellence ---SEP---,,80000080,"Dear Jim H, Thanks for your review, and feedback after your recent stay.",
3161840,50000101,"In midst of renovations, but really did not hear much or was disturbed.",80000081,80000081,"We are happy to know you enjoyed your stay, and that our renovations at the hotel did not disturb you at all!",
3161840,50000102,Would love it if the M Lounge remained on first floor - ideal location!,,80000082,"We do apologize for the missteps with the housekeeping department, and appreciate your comments.",
3161840,50000103,Concern has to do with F&B and housekeeping.,80000082,80000083,"We do our best to extend the Marriott standards, and quality our guests have come to expect, and have taken note of your feedback for our team to review.",
3161840,50000104,Food service items remained in hall for DAYS!,80000082,80000084,"We appreciate your review, and hope you will return to enjoy all of the new renovations being done at the hotel!",
3161840,50000105,Housekeeping carts blocked movement in hallway - why can't Marriott be cutting edge and develop or adopt Asian hidden housekeeping?,80000083,,,
3161840,50000106,"Finally, it seems as though if the hotel strategically places tip envelopes for housekeeping staff why not for other employees?",,,,
,,,,,,
3260044,50000110,5 star luxury and service.,,80000090,Mahalo for staying with us at Trump Waikiki during your most recent trip to Honolulu and further commenting on your vacation with us!,
3260044,50000111,---SEP---,,80000091,We are very delighted to hear that we were able to live up to your expectations.,
3260044,50000112,"While getting a special deal through Tripit.com it still is a financially high end place to stay, but worth every $.",,,,
3260044,50000113,"Excellent gym, pool and hot tub are are outdoors and have a beautiful view of the beach.",,,,
3260044,50000114,The rooms we stayed in were amazing.,,,,
3260044,50000115,The service the best i've ever experienced anywhere in the world.,,,,
,,,,,,
3267976,50000120,Very romantic ---SEP---,,80000100,"Dear Chloedoubtfire1950, Thank you for your first class review following your visit to Cardiff.",
3267976,50000121,"I was spoilt by my husband to spend the weekend in our own city at the Hilton hotel and I must say it was a luxury weekend feeling spoilt with VIP treatment, the staff were very accommodating to all our requests and went the extra mile to make sure we wanted for nothing thank you !",80000102,80000101,Your comments are very encouraging and an absolute pleasure to read.,
3267976,,,,80000102,"I will most certainly pass on your praise and gratitude to our team at the hotel, where no doubt they will further be inspired by your kind comments.",
3267976,,,,80000103,Thank you for taking the time to offer great feedback.,
3267976,,,,80000104,I do hope that we will have the opportunity of welcoming you back to the Hilton Cardiff once again in the near future.,
3267976,,,,80000105,Kind regards Marie Fagan General Manager,
,,,,,,
3240369,50000130,Close to everything.,,80000110,"Clean, comfortable and friendly is what we aim for.",
3240369,50000131,"Easy, available power for electric cars.",,80000111,The motel has a great location and I maybe bias,
3240369,50000132,---SEP--- Motel just on the edge of the main shopping strip.,80000111,80000112,but I still think we are the best valued motel in town.,
3240369,50000133,Rooms away from the street.,,,,
3240369,50000134,Close to shops and attractions.,80000111,,,
3240369,50000135,Friendly staff.,80000110,,,
3240369,50000136,Available power for an electric car.,,,,
3240369,50000137,Pricing reasonable.,,,,
3240369,50000138,Can recommend for short or long stay if not requiring indoor cooking facilities.,,,,
3240369,50000139,BBQ available.,,,,
3240369,50000140,Has pool and spa.,,,,
,,,,,,
3178303,50000150,Spacious rooms with great view ---SEP---,,80000120,Thank you so much for posting your review on TripAdvisor.,
3178303,50000151,You get what you pay for..,,80000121,Im really happy to see that you found your room to have clean and spacious and the reception team to have been understanding and polite.,
3178303,50000152,"The price is average for this hotel however, I feel like the swimming pool area needs a good clean and the changing room for the gym was appalling..",80000122,80000122,"We are always working on ways to improve our gym and pool facilities , and of course will continue to do so in the future.",
3178303,50000153,I have seen better changing rooms in public swimming pools..,80000122,80000123,We hope to see you back again soon.,
3178303,50000154,"We booked a family room with 1 double bed, 1 single bed and 1 sofa bed but we got 1 double bed and 2 sofa beds which wasn't a big issue.",,,,
3178303,50000155,Check in was slightly earlier as there was a room available and the lady at the reception was very understanding and polite.,80000121,,,
3178303,50000156,The rooms were clean and spacious..,80000121,,,
3178303,50000157,The hotel is slightly old and damp but you get what you pay for.,,,,
,,,,,,
3256452,50000160,Best in Brighton ---SEP---,,80000130,"Dear Sparkletoots, Thank you for your time to leave us this amazing review.",
3256452,50000161,This is a fantastic traditional hotel.,,80000131,"We are extremely pleased, that we are part of your happy memories, and we strongly hope to welcome you back on your next visit to Brighton.",
3256452,50000162,"The location is perfect, the rooms are spotless and airy.",,80000132,"With best wishes, Miriam, Guest Relations",
3256452,50000163,The staff are so helpful and friendly.,,,,
3256452,50000164,"The restaurant serves excellent meals, whether it be a full evening meal, snacks or a hearty breakfast.",,,,
3256452,50000165,"It's not the cheapest, but it is amazing value.",,,,
3256452,50000166,You leave with happy memories.,80000131,,,
,,,,,,
3320567,50000170,Nice hotel ---SEP--- Good location.,,80000140,"Dear Laura14429, thank you for letting us k now about your recent stay at the Hampton Inn and Suites Saskatoon Airport and thank you so much for staying with us.",
3320567,50000171,This hotel is very clean and well priced.,,80000141,I am thrilled you enjoyed your stay with us and will be sharing your review with all of our staff her at the hotel.,
3320567,50000172,Comfortable bed and amenities.,,80000142,We look forward to welcoming you back on your next trip to Saskatoon,
3320567,50000173,"The free breakfast was very good with a full selection of cereals, oatmeal, scrambled eggs, fruit, juices, breads.....",,,,
3320567,50000174,And they had yogurt which most hotels don't!,,,,
,,,,,,
3231479,50000180,WOW.,,80000150,"We are so pleased that you had such a pleasant experience staying at our park, Jasmine!",
3231479,50000181,---SEP---,,80000151,Thank you kindly for your review and we look forward to having you with us again.,
3231479,50000182,We stayed at Discovery Parks - Dubbo for 2 nights as we visited Dubbo for a Zoo visit.,,,,
3231479,50000183,"When I read the Park was close to the Zoo I didnâ€™t realise it was literally a one minute drive, it was perfect.",,,,
3231479,50000184,When we arrived to our deluxe 2 bedroom cabin we were blown away by the standard.,,,,
3231479,50000185,"Clean to an absolute high standard, bedding fresh and clean and great size.",,,,
3231479,50000186,The whole cabin was a great size and everything about it was amazing and above expectations.,,,,
3231479,50000187,"The park itself was also outstanding, perfect for kids with a jumping pillow, pool and water park with a great slide my two boys loved.",,,,
3231479,50000188,My 6 year old also thought the BMX track was awesome fun.,,,,
3231479,50000189,We will no doubt be definitely staying here again.,,,,
3231479,50000190,5 stars without a doubt.,,,,
,,,,,,
3227743,50000200,Great helpful staff ---SEP---,,80000160,Thank you for your feedback regarding your recent stay at Holiday Inn Tampa Westshore Airport.,
3227743,50000201,I checked into the Holiday Inn on business and was blown away by there great staff.,,80000161,"I couldn't be more thrilled to hear that you received such memorable service from Janice, Ruby and Samira.",
3227743,50000202,At the front desk Janice went out her way to find information for me regard their rewards program.,80000161,80000162,I will certainly share your kind words with them and recognize them for their service.,
3227743,50000203,This woman has the patience of a saint because my guest and I had tons of questions for her.,80000161,80000163,We appreciate you choosing our hotel and hope to see you again very soon!,
3227743,50000204,With the help of Ruby and Samira my check in was smooth and very informative.,80000161,,,
3227743,50000205,"Besides the great rooms and super comfortable beds, I would stay at this hotel every time I'm in town because of the warm, inviting and friendly staff.",,,,
,,,,,,
3318529,50000210,Fantastic location and amazing hospitality ---SEP---,,80000170,"Dear Shannon B, Thank you so much for your kind words!",
3318529,50000211,We loved the character and history of this hotel.,,80000171,Your recommendation means the world to us...,
3318529,50000212,"The location is fantastic, you can walk all around the historic area.",,80000172,our staff loves welcoming guests from all over the world,
3318529,50000213,"The staff was so nice and courteous from the valet taking our car, the bellmen, front desk staff and the servers for breakfast.",80000172,80000173,and I am so happy you felt at home with us at The Marshall House!,
3318529,50000214,We would stay here again.,,80000174,We can't wait to welcome you back!,
3318529,,,,80000175,"Warm Regards, Kaitlin / Assistant Manager",
,,,,,,
3178561,50000220,Excellent service.,,80000180,"Dear Nancy R S, Thank you so much for taking the time to write us about your recent stay at Loews Chicago Hotel.",
3178561,50000221,---SEP--- Classy and friendly.,,80000181,I am thrilled to hear about your five star worthy experience with us.,
3178561,50000222,Rooms terrific.,,80000182,"I appreciate your wonderful comments about our friendly team, location, and our outdoor restaurant, Streeterville Social.",
3178561,50000223,Business center very well stocked with supplies.,,80000183,We know you have many options to choose from and we thank you for choosing Loews Chicago.,
3178561,50000224,Near the spot to pick up river cruise/tour groups.,80000182,80000184,We look forward to seeing you again very soon.,
3178561,50000225,It has a lovely roof top bar on the 3rd floor.,80000182,80000185,"Best, Christian Hansen Managing Director",
3178561,50000226,It is about a 2mile walk to the Chicago History Museum and about a 20 walk to the Loop.,80000182,,,
3178561,50000227,It is more expensive than other near by hotels..but I found it to be worth it.,80000181; 80000183,,,
,,,,,,
3319899,50000230,Great family getaway ---SEP---,,80000190,Hi Nicole and youâ€™ve made our day by giving us a 5 star review â€“ thank you!,
3319899,50000231,"Very friendly and helpful staff, always saw someone around cleaning.. so much for the children to do without leaving the park, very clean and tidy.. accommodation and public kitchen area clean and tidy (after staff had cleaned up after some disrespectful people) not to far out of town but far enough to feel secluded ðŸ˜†",,80000191,Your comments are a pleasure to read and we look forward to having the pleasure of welcoming you and your family back again for another getaway.,
,,,,,,
3271804,50000240,So many positives ---SEP---,,80000200,"Hell akaciczo, Just wanted to message you back to say a big thank you from the team here at the Clayton Hotel Burlington Road for the lovely comments and the excellent score you have awarded us.",
3271804,50000241,Shower in our suite had a slow drain so you risked a flood if you were in longer than 5 minutes.,,80000201,Really hope to see you again soon and the team would be delighted to welcome you back.,
3271804,50000242,"Suite also had a bathtub with a separate shower head, so the shower flooding was irrelevant.",,80000202,"Again, thank you so much for the time and custom you gave us as it is very much appreciated.",
3271804,50000243,Bed was huge and extremely comfortable but they did not provide us with extra blankets which would have helped when we couldnâ€™t figure out how to use the remote controlled heater.,,80000203,Kind Regards Daniel O' Connor Customer Service Manager,
3271804,50000244,"Plates are as hot as lava at the breakfast buffet, but the food selection was vast and absolutely delicious - great way to start the day.",,,,
3271804,50000245,"Business center offers a free printer so you can print your boarding pass before leaving, just make sure itâ€™s set to print to the correct printer.",,,,
3271804,50000246,"The gym was the largest and most equipped of all hotel gyms Iâ€™ve ever seen, but you may get locked in if you donâ€™t know how the doors work (yeah this is a thing).",,,,
3271804,50000247,Thereâ€™s also a great view from the gym.,,,,
3271804,50000248,Elevators were extremely quick.,,,,
3271804,50000249,"Bar is huge, but service for cocktails or mixed drinks can be a bit slow.",,,,
3271804,50000250,"While you can order room service at any hour, it would be great if there were snack machines available for a late night fix as the closest convenience store is a 15 minute walk.",,,,
3271804,50000251,"Taxi queue is right outside and they are always available, so is the bus stop.",,,,
3271804,50000252,Walk to town is 15-20 minutes.,,,,
3271804,50000253,Quiet rooms and neighborhood.,,,,
,,,,,,
3175380,50000260,Staff so friendly!,,80000210,Dear Mundas Thank you for taking the time to write a review on TripAdvisor and sharing your views with the TripAdvisor community.,
3175380,50000261,---SEP---,,80000211,I am pleased to read that you enjoyed your stay and found the staff to be friendly and polite.,
3175380,50000262,We came to Leeds for a hen do and were very pleasantly surprised at how friendly the manager and his staff were.,80000211,80000212,I hope that I have the opportunity to welcome you back to Leeds in the future Kind Regards James,
3175380,50000263,Quite often in the big cities the personal touch is lost but the staff couldn't have done enough for us.,80000211,,,
3175380,50000264,The rooms are very comfortable modern and clean and the breakfast very good too.,,,,
3175380,50000265,We are so impressed we will be back!,,,,
,,,,,,
3286764,50000270,Great place for sightseeing and shopping in Sydney ---SEP---,,80000220,"Dear Odyssey37472016640, Thank you kindly for sharing these comments with other travelers!",
3286764,50000271,"Just a great hotel, from the moment you walk in you want to stay forever.",80000221,80000221,"I am delighted to learn you feel that way, and that our iconic and convenient location made for a great shopping experience.",
3286764,50000272,Location is fantastic for shoppers and sightseers a like with easy access to Sydneys underground transport system that will get you anywhere fast and only 1 min walk from all the great Sydney shops!,80000221,80000222,We will look forward to seeing you again soon.,
